Department,Entity,Date,Expense Type,Expense Area,Supplier ,Transaction Number,Amount,Description,Supplier Postcode,Supplier Type,Contract Number,Project Code,Expenditure Type,Vat Registration Num
DEFRA,NE,17/06/2024,EXP - PURCHASE OF GOODS/SERVICES - END USER SOFTWARE AND HARDWARE,SECURITY & INFORMATION,DEFRA,334148,43776.48,IT Services,YO1 7PX,SUPPLIER,DFP (DEFRA),00000000,Expense,888800181.
DEFRA,NE,18/06/2024,EXP - PURCHASE OF GOODS/SERVICES - OTHER - PROGRAMME EXPENDITURE,ANALYTICS TEAM,DEFRA,334155,256076.40,Alpha and Beta phases of Conservation Management System International (CMSi) replacement project 23-24,YO1 7PX,SUPPLIER,DFP (DEFRA),00000000,Expense,888800181.
DEFRA,NE,18/06/2024,EXP - PURCHASE OF GOODS/SERVICES - OTHER - PROGRAMME EXPENDITURE,ANALYTICS TEAM,DEFRA,334159,81544.86,IT Services,YO1 7PX,SUPPLIER,DFP Exemption,00000000,Expense,888800181.
DEFRA,NE,18/06/2024,PPE - POA & AUC (OWNED) - COST - ADDITIONS - BUILDINGS,NNR SERVICES TEAM,MITIE FM LTD,239921/93015476,30334.74,Works at Pewsey Down National Nature Reserve,SE18RT,SUPPLIER,Atamis Reference: C22475,00000000,Asset,GB 362869361
DEFRA,NE,18/06/2024,EXP - PURCHASE OF GOODS/SERVICES - OTHER - PROGRAMME EXPENDITURE,ANALYTICS TEAM,DEFRA,334157,28830.16,Alpha and Beta phases of Conservation Management System International (CMSi) replacement project 23-24,YO1 7PX,SUPPLIER,DFP (DEFRA),00000000,Expense,888800181.
DEFRA,NE,19/06/2024,EXP - CURRENT GRANTS TO PRIVATE SECTOR - NON PROFIT INSTITUTIONS SERVING H'HOLD,"SGA STRATEGY, FUNDING & PEOPLE FOR NATURE",THE WASH LANDSCAPE PARTNERSHIP,LRTHEWASHLANDSCAPEPARTNERSHIP,58000.00,Grant - The Wash landscape advanced payment,PE317PQ,SUPPLIER,,00000000,Expense,
DEFRA,NE,20/06/2024,EXP - CAPITAL GRANTS TO LOCAL GOVERNMENT,Peat Capital Grants,YORKSHIRE WILDLIFE TRUST,ERS-100900057569-325817,412615.32,Grant - Nature for Climate Peatland Grant Scheme - Restoration- 2023/24,YO24 1GN,3RD SECTOR SUPPLIER,,NE163785,Expense,235804804
DEFRA,NE,20/06/2024,EXP - PURCHASE OF GOODS/SERVICESĀ- RESEARCH & DEVELOPMENT - OTHER OUTSOURCED,POSEIDON PROJECT,APEM LTD,008188,110956.00,POSEIDON project North Sea Digital Aerial Surveys,SK4 3GN,SUPPLIER,Atamis reference C2056077,NE163827,Expense,
DEFRA,NE,20/06/2024,EXP - CURRENT GRANTS TO PRIVATE SECTOR - NON PROFIT INSTITUTIONS SERVING H'HOLD,"SGA STRATEGY, FUNDING & PEOPLE FOR NATURE",ALBANWISE ENVIRONMENTAL LTD,ERS-100900057549-325819,78056.80,Grant - Landscape Recovery Grant - Leven Carrs,PE33 9GF,SUPPLIER,ecm_66509,00000000,Expense,GB864427896
DEFRA,NE,20/06/2024,PPE - PLANT & MACHINERY (OWNED) - COST - ADDITIONS,NNR SERVICES TEAM,LOGLOGIC,7875,87052.80,Specialist soft track off road vehicle,EX15 1RW,SUPPLIER(1),Atamis Reference: C22229,NE161410,Asset,
DEFRA,NE,20/06/2024,EXP - PURCHASE OF GOODS/SERVICES - OTHER- SCIENCE & EVIDENCE MONITORING SURVLNCE,CATCHMENT SENSITIVE FARMING,RSK ADAS LIMITED,SI6942065,79388.40,Catchment Sensitive Farming 1:1 on Farm Advice,WA6 0AR,SUPPLIER(1),C19866,00000000,Expense,"GB256435886					"
DEFRA,NE,20/06/2024,PPE - PLANT & MACHINERY (OWNED) - COST - ADDITIONS,NNR SERVICES TEAM,LOGLOGIC,7872,104328.00,Specialist soft track off road vehicle,EX15 1RW,SUPPLIER(1),Atamis Reference: C22229,NE161410,Asset,
DEFRA,NE,20/06/2024,EXP - PURCHASE OF GOODS/SERVICESĀ- RESEARCH & DEVELOPMENT - OTHER OUTSOURCED,"SGA LANDSCAPE, PEAT & SPECIES",BAT CONSERVATION TRUST,1378,48000.00,Bat Advice survey analysis and report,SW8 4BG,CUSTOMER,C21713,NE163979,Expense,877 1587 73
DEFRA,NE,24/06/2024,EXP - CAPITAL GRANTS TO LOCAL GOVERNMENT,Peat Capital Grants,SOUTH WEST WATER LTD,ERS-100900057614-326019,1010303.74,Grant - Nature for Climate Peatland Grant Scheme - Restoration- 2023/24,EX2 7HR,CUSTOMER,ECM62240,NE163785,Expense,"540465165					"
DEFRA,NE,24/06/2024,EXP - CAPITAL GRANTS TO LOCAL GOVERNMENT,Peat Capital Grants,MICROPROPAGATION SERVICES E M LTD,ERS-100900057624-326024,222459.07,Grant - NCPGS 2023-24 Paludiculture Exploration Fund grant scheme,LE12 6NZ,SUPPLIER,,00000000,Expense,428529138
DEFRA,NE,24/06/2024,EXP - CURRENT GRANTS TO PRIVATE SECTOR - NON PROFIT INSTITUTIONS SERVING H'HOLD,"SGA WATER, LAND AND SEAS",LANCASHIRE WILDLIFE TRUST LTD,ERS-100900057618-326018,111839.23,Grant - Landscape Recovery Grant - Wigan Greenheart,PR5 6BY,CUSTOMER,,00000000,Expense,265 7548 65
DEFRA,NE,24/06/2024,EXP - CAPITAL GRANTS TO LOCAL GOVERNMENT,Peat Capital Grants,MICROPROPAGATION SERVICES E M LTD,ERS-100900057623-326023,72594.98,Grant - NCPGS 2023-24 Paludiculture Exploration Fund grant scheme,LE12 6NZ,SUPPLIER,,00000000,Expense,428529138
DEFRA,NE,24/06/2024,EXP - CAPITAL GRANTS TO LOCAL GOVERNMENT,Peat Capital Grants,ROYAL SOCIETY FOR THE PROTECTION OF BIRDS,ERS-100900057611-326020,46430.61,Grant - Nature for Climate Peatland Grant Scheme - Restoration- 2023/24,SG19 2DL,CUSTOMER,,NE163785,Expense,GB 365 9695 89
DEFRA,NE,24/06/2024,EXP - CURRENT GRANTS TO PRIVATE SECTOR - NON PROFIT INSTITUTIONS SERVING H'HOLD,"SGA WATER, LAND AND SEAS",BOOTHBY WILDLAND LIMITED,ERS-100900057641-326026,35697.40,Grant - Landscape Recovery Grant - Boothby Wildlands,NR7 0HR,SUPPLIER(1),,00000000,Expense,
DEFRA,NE,24/06/2024,EXP - PURCHASE OF GOODS/SERVICES - OTHER - PROGRAMME EXPENDITURE,LIFE WADER,UNIVERSITY OF NEWCASTLE UPON TYNE,ERS-100900057606-326017,27989.58,Grant - UNEW share of WADER grant ,NE1 7RU,Public Body,ECM_63972 (multiple partners),NE162822,Expense,499672470
DEFRA,NE,24/06/2024,EXP - CAPITAL GRANTS TO LOCAL GOVERNMENT,Peat Capital Grants,ROYAL SOCIETY FOR THE PROTECTION OF BIRDS,ERS-100900057635-326021,26619.12,Grant - Nature for Climate Peatland Grant Scheme - Restoration- 2023/24,SG19 2DL,CUSTOMER,,NE163785,Expense,GB 365 9695 89
DEFRA,NE,25/06/2024,CA - OTHER RECEIVABLES - TRAVEL PROVIDER CONTROL ACCOUNT,CORPORATE CONTRACTS,CTM NORTH LTD,8896,233033.34,Charge for travel costs ,BD1 5HQ,SUPPLIER,,00000000,Asset,GB708374133
DEFRA,NE,26/06/2024,CA - OTHER RECEIVABLES - TRAVEL PROVIDER CONTROL ACCOUNT,CORPORATE CONTRACTS,CTM NORTH LTD,19039,320836.76,Charge for travel costs ,BD1 5HQ,SUPPLIER,,00000000,Asset,GB708374133
DEFRA,NE,26/06/2024,EXP CAPITAL GRANTS TO PTE SECTOR - PERSONS & NON PROFIT INSTIT'NS SERVING H'HOLD,"SGA LANDSCAPE, PEAT & SPECIES",NORFOLK WILDLIFE TRUST,ERS-100900057659-326181,77280.53,Grant - Species Recovery Programme - Pool Frogs and Pingos - 2023-24,NR1 1RY,SUPPLIER,20460,NE163980,Expense,GB876322506
DEFRA,NE,26/06/2024,EXP - PURCHASE OF GOODS/SERVICES - OTHER - PROGRAMME EXPENDITURE,POSEIDON PROJECT,APEM LTD,008207,78331.06,POSEIDON project Celtic Sea Digital Aerial Surveys,SK4 3GN,SUPPLIER,C20704,NE163827,Expense,
DEFRA,NE,28/06/2024,EXP - CAPITAL GRANTS TO LOCAL GOVERNMENT,Peat Capital Grants,FENLAND SOIL LTD,ERS-100900057692-326358,64732.01,Grant - NCPGS 2023-24 Paludiculture Exploration Fund grant scheme,CB7 5GT,SUPPLIER,,00000000,Expense,GB416617205
DEFRA,NE,28/06/2024,EXP - CAPITAL GRANTS TO LOCAL GOVERNMENT,Peat Capital Grants,UK CENTRE FOR ECOLOGY & HYDROLOGY,ERS-100900057695-326359,62682.75,Grant - NCPGS 2023-24 Paludiculture Exploration Fund grant scheme,OX10 8BB,SUPPLIER,,00000000,Expense,
DEFRA,NE,28/06/2024,EXP - CAPITAL GRANTS TO LOCAL GOVERNMENT,STATUTORY ACCESS,NORFOLK COUNTY COUNCIL,10080605,34736.48,Grant - Hunstanton to Sutton Bridge Planning Grant,NR20 4DR,SUPPLIER,C22897,NE160885,Expense,106 995 152
DEFRA,NE,28/06/2024,EXP - PURCHASE OF GOODS/SERVICES - OTHER ICT COSTS,ANALYTICS TEAM,ESRI (UK) LTD,UK-PIN104589,39174.32,ESRI Natural England for Supersite redevelopment,HP21 7QG,SUPPLIER,,00000000,Expense,787 430791
DEFRA,NE,28/06/2024,EXP - PURCHASE OF GOODS/SERVICESĀ- RESEARCH & DEVELOPMENT - OTHER OUTSOURCED,Net Gain,EUNOMIA RESEARCH & CONSULTING LTD,INV-UK-005329,28984.31,Design and delivery of a monitoring and evaluation programme for Biodiversity Net Gain,BS1 4QS,SUPPLIER,36036,NE163951,Expense,771922024
DEFRA,KEW,01/04/2024,Consumables & Materials,Commercial Activities,Meta Platform Ireland Limited,7117573,42615.98,Joe Wicks Festival - Meta Adverts March 2024,D04 X2K5,Rest of the World,,66104,Digital Marketing,
DEFRA,KEW,10/04/2024,Finance Charges,Human Resources,Metlife Europe Limited,1013293,56920.00,Human Resources - Insurance - Group Life Assurance Premium Deposit  24/25,KT14 6EY,UK Supplier,,60001,Insurance,
DEFRA,KEW,10/04/2024,Consultancy & Professional Services,Information Technology,Civica UK Ltd,7115083,49724.00,IT Operations - Kew Sharepoint Migration Work 4 Week Pre-Discovery,SE1 9LQ,UK Supplier,,60002,Professional Services - IT,GB 391 1710 65
DEFRA,KEW,10/04/2024,Utilities,Estates,EDF Energy Customers plc,7115128,160762.68,Estates Wakehurst Energy - Act 4124210000 Invoice Period: 06 Feb 24 - 05 Mar 24,PL3 5RG,UK Supplier,,60043,Electricity - Grid,
DEFRA,KEW,10/04/2024,Consumables & Materials,Marketing & Membership,Haymarket Media,7115203,63527.00,Membership & Donate Marketing - Kew Magazine Spring 2024 Production,TW1 3SP,UK Supplier,,60541,Publication production costs,GB232584272
DEFRA,KEW,10/04/2024,Consumables & Materials,P1: Ecosystem Stewardship,Genewiz UK Ltd,7114951,44744.00,Expansion of NCEA soil monitoring to develop high-resolution mycorrhizal maps and enhance ecosystem metrics - Mycorrhizal Pacbio Sequencing 7 Plates,CM22 6TA,UK Supplier,,11711,Lab chemicals & materials,231507736
DEFRA,KEW,10/04/2024,Consultancy & Professional Services,Information Technology,NETconnection Systems (Part of Charterhouse Voice & Data Group),7115150,51558.90,"IT Capital Projects - Extremecloud Iq Pilot Saas Subscription And Pwp S,Etc",EC2A 3SB,UK Supplier,,11188,Professional Services - IT,311 3890 28
DEFRA,KEW,10/04/2024,Consultancy & Professional Services,P3: Digital Revolution,Max Communication Ltd,7115521,333086.00,Digitisation - Digitisation April 2024,SE18 6SW,UK Supplier,,11647,Third Party Contracts,739932881
DEFRA,KEW,10/04/2024,Consultancy & Professional Services,P0: Science Services & Labs,Cooper Clarke Construction Ltd,7115495,77238.80,Defra Science Capex Work 2023-24 - Herbarium Basement Works,ME19 5AA,UK Supplier,,11768,Prof Fees - Construction,683508121
DEFRA,KEW,10/04/2024,Payment to 3rd party,P1: Ecosystem Stewardship,Durrell Wildlife Conservation Trust,7115089,115182.50,Achieving sustainable forest management through community managed protected areas in Madagascar - Invoice Kew008 Dwct Q3,JE3 5BP,UK Supplier,,11630,Non-Kew Project Costs,
DEFRA,KEW,10/04/2024,Capital/Equipment,Capital Development Programme,Alternative Heat,7115312,676093.70,Jodrell Decarbonisation Project - Claim No Ashp71.08,BT32 3QD,UK Supplier,,11665,Design,858745176
DEFRA,KEW,10/04/2024,Consultancy & Professional Services,Capital Development Programme,Cambridge Glasshouse Ltd,7115484,461987.25,ICW projects - Valuation 3 Kew,HU15 2RH,UK Supplier,,11733,Prof Fees - Construction,GB 779 7452 62
DEFRA,KEW,10/04/2024,Property Related,Wakehurst,Reesink UK Ltd,7115249,27972.43,"Hort Capital Equipment - Rbgkew1241, Workman Mdx Lithium",PE19 1QF,UK Supplier,,11185,Garden machinery & equipt,GB227876078
DEFRA,KEW,10/04/2024,Capital/Equipment,Capital Development Programme,Goody Demolition Ltd,7115505,49094.62,Lansdown Conservation & Research Nursery (Wakehurst) - Project G3082 Havelock Farm Demo Works,CT3 3EP,UK Supplier,,11727,New works-Pt I-other costs,624 952 037
DEFRA,KEW,10/04/2024,Consultancy & Professional Services,P1: Ecosystem Stewardship,Space Intelligence Ltd,7115340,44000.00,"Achieving sustainable forest management through community managed protected areas in Madagascar - Landcover Map - Madagascar,Upon Delivery Of Land Cover Map: Payment Of Remaining 50% Of Total Charges",EH2 3ES,UK Supplier,,11630,Prof Fees - Conservn & Sustain,342811714
DEFRA,KEW,10/04/2024,ICT,Information Technology,Avoira Ltd,7115070,29355.00,"IT Capital Projects - 1 X Yealink Mvcs90 Including 3 Years Warranty, 1 X Sony 65Bz35L, 1 X Unicol Ceiling Mount Kit, 1 X Jramer Hdmi 1.6M, 1 X Unicol Camera Mount, 1 X Extron Ipcp Pro 360Qxi, 1 X Extron Tlp Pro 725T, 1 X Sg108 Poe Switch, Installation And Programming",BL9 6YA,UK Supplier,,11188,"Computer EQPT Ż5,000 and over",GB823819517
DEFRA,KEW,17/04/2024,ICT,Information Technology,Unit4 Business Software Ltd,7115833,59408.93,IT Operations - Unit4 Agresso Support And  Maintenance 01/04/2024 To31/03/2025,BS20 0PX,UK Supplier,,60002,Software Maintenance,
DEFRA,KEW,17/04/2024,Capital/Equipment,Capital Development Programme,Climate Controls,7115802,38939.00,ICW projects - Supply And Install 99No Elixia Led Grow Lights Lower Nus,GY8 0JD,UK Supplier,,11733,New works-Pt I-other costs,
DEFRA,KEW,17/04/2024,Property Related,Living Collections,Gibsons Garden Machinery Ltd,7115633,49319.69,"DEFRA Funded Horticulture Equipment (Kew) - Rbgkew1291, 3 Pedestrian Battery Electric Cylinder Mowers",BB8 8LJ,UK Supplier,,11122,Garden machinery & equipt,748 7053 06
DEFRA,KEW,17/04/2024,Consumables & Materials,P1: Ecosystem Stewardship,Genewiz UK Ltd,7115694,40551.60,Expansion of NCEA soil monitoring to develop high-resolution mycorrhizal maps and enhance ecosystem metrics - Mycorrhizal Pacbio Sequencing,CM22 6TA,UK Supplier,,11711,Lab chemicals & materials,231507736
DEFRA,KEW,17/04/2024,Property Related,Estates,Y2K Construction Ltd,7115825,103304.00,Estates Kew Operating Maintenance - (Planet Wo 56912) Herbarium Car Park -,RG42 7NY,UK Supplier,,60449,Maintenance-Reactive,731665924
DEFRA,KEW,17/04/2024,Capital/Equipment,Capital Development Programme,Y2K Construction Ltd,7115868,90321.55,Infrastructure Capital Works - School Entrance Wc'S,RG42 7NY,UK Supplier,,11732,New works-Pt I-other costs,731665924
DEFRA,KEW,17/04/2024,Capital/Equipment,Capital Development Programme,Y2K Construction Ltd,7115878,76123.46,Infrastructure Capital Works - Project - Boundary Fencing Works,RG42 7NY,UK Supplier,,11732,New works-Pt I-other costs,731665924
DEFRA,KEW,17/04/2024,Consultancy & Professional Services,Executive Directorate,Avanade UK Limited,7115793,203753.50,Visitor Facing Systems - March 2024 Fees,EC4M 6XH,UK Supplier,,60447,Professional Services - IT,GB 788 629 066
DEFRA,KEW,17/04/2024,Capital/Equipment,Capital Development Programme,Raytell Electrical Co. Ltd,7115747,49806.07,Infrastructure Capital Works Kew 2021/22 - Led Lighting Upgrades,N14 5DJ,UK Supplier,,11584,Design,230699848
DEFRA,KEW,17/04/2024,Utilities,Estates,Smarta Water Ltd,7115779,184117.64,Estates Kew Energy - Act Sma000200-00 Outstanding Amount,LS27 7QZ,UK Supplier,,60036,Water rates,272645196
DEFRA,KEW,17/04/2024,Consultancy & Professional Services,Capital Development Programme,Cooper Clarke Construction Ltd,7115776,130941.67,"Capital Development Programme Central - Wakehurst Place, Decarbonisation Salix Insulation",ME19 5AA,UK Supplier,,11229,Prof Fees - Construction,683508121
DEFRA,KEW,17/04/2024,Payment to 3rd party,P2: Trait Diversity and Function,World Forest ID Association,7115684,84405.00,Building and Enhancing the Evidence Base for Nature Based Solutions to Climate Change: Soy Traceability - Phase 3 World Forest Id Non Timber Forest Risk Commodity Science-Based Traceability (Q1 2024),20005,Rest of the World,,11638,Non-Kew Project Costs,NA
DEFRA,KEW,17/04/2024,Property Related,P1: Ecosystem Stewardship,Shandon Diagnostics Ltd,7115577,64900.00,"Expansion of NCEA soil monitoring to develop high-resolution mycorrhizal maps and enhance ecosystem metrics - Midi Ii Slide Scanner, With Gold Service Package",WA7 1TA,UK Supplier,,11711,Laboratory machinery & equipt,GB876329974
DEFRA,KEW,23/04/2024,Payment to 3rd party,P1: Ecosystem Stewardship,The Peregrine Fund FMhL,7117708,27887.00,"Achieving sustainable forest management through community managed protected areas in Madagascar - Ddl17/P2,Fp54, Invoice No. 10 The Peregrine Fund Year 3 Q4 Jan 01 To Mar 30 2024",83709,Rest of the World,,11630,Non-Kew Project Costs,NA
DEFRA,KEW,25/04/2024,Property Related,Wakehurst,Farol Ltd,7115897,114800.00,"Hort Capital Equipment - Rbgkew1268, 1 Electric Mini Loader, 1 Bomford Flailbot & 1 Bomford Stump Grinder",OX9 2NZ,UK Supplier,,11185,Garden machinery & equipt,
DEFRA,KEW,25/04/2024,Consultancy & Professional Services,Capital Development Programme,Ground Control Limited,7115914,156321.60,"Infrastructure Capital Works - Kew Orangery Landscaping, Planters And Seating , Design Works",CM12 0EQ,UK Supplier,,11732,Prof Fees - Construction,406427959
DEFRA,KEW,25/04/2024,Consultancy & Professional Services,Estates,Low Carbon Europe,7115929,27962.50,Estates Kew Energy - Fees In Connection With Retained Energy And Environmental Management Services At Kew Gardens,BN1 1WN,UK Supplier,,60036,Prof Fees - Operational Serv,988708742
DEFRA,KEW,25/04/2024,Property Related,Estates,Y2K Construction Ltd,7115938,124592.00,"Estates Kew Operating Maintenance - Temporary Parking Between Trees, As Per Quotation. 20/02/24",RG42 7NY,UK Supplier,,60449,Maintenance-Reactive,731665924
DEFRA,KEW,25/04/2024,Property Related,Estates,Noonan Services Group ( UK ) Ltd,7116201,68244.36,Estates Kew Operating - Cleaning Labour Including Litter Picking  1 Mar 2024 - 31 Mar 2024,EC2A4LP,UK Supplier,,60038,Office and window cleaning,GB 847176988
DEFRA,KEW,25/04/2024,ICT,Creative Services,Icam Archive Systems Ltd,7116196,27970.00,Creative Studio Operating - Phase One Iq3/Xf Camera System Scneider-Kreuznach 120Mm Lens,ST13 5HP,UK Supplier,,60022,Photo machinery & equipt,GB546053453
DEFRA,KEW,25/04/2024,ICT,Information Technology,NETconnection Systems (Part of Charterhouse Voice & Data Group),7115531,36265.02,IT Operations - Extreme Support Renewal 24/05/2024 To 23/05/2025,EC2A 3SB,UK Supplier,,60002,Hardware Maintenance and Repairs,311 3890 28
DEFRA,KEW,25/04/2024,Consultancy & Professional Services,Digital Experience,Fresh Air Productions (also Neil Cowling Ltd),7116092,25000.00,Digital Media - Podcast Promotional Spend & Media Resource Contracts,SN14BH,UK Supplier,,60019,Prof Fees - Digital Media,802919042
DEFRA,KEW,25/04/2024,Consultancy & Professional Services,Information Technology,Avanade UK Limited,7116049,72196.50,IT Operations - February 2024 Fees; March 2024 Fees,EC4M 6XH,UK Supplier,,60002,Professional Services - IT,GB 788 629 066
DEFRA,KEW,25/04/2024,Capital/Equipment,Capital Development Programme,H A Marks Ltd,7115920,255912.80,Infrastructure Capital Works - Nas Conservatory,SE27 0DN,UK Supplier,,11732,Design,239207464
DEFRA,KEW,25/04/2024,Capital/Equipment,Capital Development Programme,H A Marks Ltd,7115915,36641.75,Infrastructure Capital Works - Nash Conservatory,SE27 0DN,UK Supplier,,11732,Design,239207464
DEFRA,KEW,25/04/2024,Capital/Equipment,Capital Development Programme,Goody Demolition Ltd,7116004,57389.22,Lansdown Conservation & Research Nursery (Wakehurst) - Project G3082 Havelock Farm Demo Works,CT3 3EP,UK Supplier,,11727,New works-Pt I-other costs,624 952 037
DEFRA,KEW,25/04/2024,Consultancy & Professional Services,P1: Ecosystem Stewardship,Cambridge Consultants Ltd,7115918,45000.00,Expansion of NCEA soil monitoring to develop high-resolution mycorrhizal maps and enhance ecosystem metrics - Amf Quantification Phase 1,CB4 0DW,UK Supplier,,11711,Professional Services - IT,GB213291986
DEFRA,KEW,26/04/2024,Payment to 3rd party,P1: Ecosystem Stewardship,Missouri Botanical Garden,7117710,99626.01,"Achieving sustainable forest management through community managed protected areas in Madagascar - Ddl17/P2,Fp56,Invoice No. 10  Missouri Botanical Garden Year 3 Q4 Jan 01 To Mar 30 2024",63110-2226,Rest of the World,,11630,Non-Kew Project Costs,0
DEFRA,JNCC,30/05/2024,CONTRACTED OUT CONSERVATION SERVICES   ,,THOMSON ENVIRONMENTAL CONSULTANTS LIMITED                   ,25513,26568.00,HPMA Infauna analysis (for expert support for our critical role in protecting the UKÆs biodiversity both on land and sea),GU2 7AG ,,F21-0708-1581 ,711,Programme / Administration ,
DEFRA,NE,01/05/2024,EXP - PURCHASE OF GOODS/SERVICES - OTHER - PROGRAMME EXPENDITURE,POSEIDON PROJECT,CEFAS,8011939,453853.07,POSEIDON project Cefas Specialist Time plus Benthic Survey,NR33 0HT,SUPPLIER,,NE163827,Expense,GB 888 8001 81
DEFRA,NE,01/05/2024,EXP - CAPITAL GRANTS TO LOCAL GOVERNMENT,Peat Capital Grants,PEAK DISTRICT NATIONAL PARK AUTH,ERS-100900056746-323136,144072.28,Grant - Nature for Climate Peatland Grant Scheme - Restoration- 2023/24,DE45 1AE,LOCAL AUTHORITIES,,NE163785,Expense,313 1215 64
DEFRA,NE,01/05/2024,EXP - CAPITAL GRANTS TO LOCAL GOVERNMENT,Peat Capital Grants,ROYAL SOCIETY FOR THE PROTECTION OF BIRDS,ERS-100900056780-323135,139291.82,Grant - Nature for Climate Peatland Grant Scheme - Restoration- 2023/24,SG19 2DL,CUSTOMER,,NE163785,Expense,GB 365 9695 89
DEFRA,NE,01/05/2024,EXP - CAPITAL GRANTS TO LOCAL GOVERNMENT,Peat Capital Grants,NATIONAL TRUST,ERS-100900056779-323131,65809.44,Grant - Nature for Climate Peatland Grant Scheme - Restoration- 2023/24,SN2 2NA,SUPPLIER,C20518,NE163785,Expense,GB239503167
DEFRA,NE,01/05/2024,EXP - CAPITAL GRANTS TO LOCAL GOVERNMENT,STATUTORY ACCESS,WEST SUSSEX COUNTY COUNCIL,8001753408,54311.74,Grant - King Charles III England Coast 23/24 planning costs,PO19 1RG,SUPPLIER,C19735,NE160885,Expense,193 604 455
DEFRA,NE,01/05/2024,EXP CAPITAL GRANTS TO PTE SECTOR - PERSONS & NON PROFIT INSTIT'NS SERVING H'HOLD,NATURE RETURNS (SOF-NBS),GLOUCESTERSHIRE WILDLIFE TRUST (G),ERS-100900056762-323137,32771.04,Grants - 23/24 - Severn Solutions for Nature,GL4 6SX,SUPPLIER,Atamis C16841,00000000,Expense,
DEFRA,NE,02/05/2024,IA - POA & AUC - COST - ADDITIONS,NUTRIENT MITIGATION SCHEME,DEFRA,332723,1904696.40,Nutrient Mitigation Scheme,YO1 7PX,SUPPLIER,DEFRA family payment DFP,00000000,Asset,888800181.
DEFRA,NE,02/05/2024,EXP - PURCHASE OF GOODS/SERVICES - END USER SOFTWARE AND HARDWARE,NEG Governance,DEFRA,329260,1173706.80,IT Services,YO1 7PX,SUPPLIER,DFP,00000000,Expense,888800181.
DEFRA,NE,02/05/2024,IA - POA & AUC - COST - ADDITIONS,Net Gain,DEFRA,331697,1007831.90,Support services staff costs,YO1 7PX,SUPPLIER,Defra family payments DFP,00000000,Asset,888800181.
DEFRA,NE,02/05/2024,EXP - PURCHASE OF GOODS/SERVICES - OTHER - PROGRAMME EXPENDITURE,NUTRIENT MITIGATION SCHEME,DEFRA,333152,356264.70,Nutrient Mitigation Scheme,YO1 7PX,SUPPLIER,DEFRA family payment DFP,NE163925,Expense,888800181.
DEFRA,NE,02/05/2024,IA - POA & AUC - COST - ADDITIONS,Net Gain,DEFRA,331696,735386.87,Support services staff costs,YO1 7PX,SUPPLIER,DFP (Defra family payment),00000000,Asset,888800181.
DEFRA,NE,02/05/2024,EXP CAPITAL GRANTS TO PTE SECTOR - PERSONS & NON PROFIT INSTIT'NS SERVING H'HOLD,NATURE RETURNS (SOF-NBS),DERBYSHIRE WILDLIFE TRUST (G),ERS-100900056794-323210,92874.99,Grant - Nature Based Solutions for Climate Change on a Landscape Scale - Derwent Forest,DE4 4LR,SUPPLIER,,00000000,Expense,
DEFRA,NE,02/05/2024,IA - POA & AUC - COST - ADDITIONS,NUTRIENT MITIGATION SCHEME,DEFRA,330180,108000.00,Nutrient Mitigation Scheme,YO1 7PX,SUPPLIER,DFP - Defra Family Payment,00000000,Asset,888800181.
DEFRA,NE,02/05/2024,EXP - PURCHASE OF GOODS/SERVICES - OTHER- SCIENCE & EVIDENCE MONITORING SURVLNCE,CATCHMENT SENSITIVE FARMING,RSK ADAS LIMITED,SI6941228,98955.60,Catchment Sensitive Farming 1:1 on Farm Advice,WA6 0AR,SUPPLIER(1),C19866,00000000,Expense,"GB256435886					"
DEFRA,NE,02/05/2024,EXP - PURCHASE OF GOODS/SERVICES - OTHER - PROGRAMME EXPENDITURE,ANALYTICS TEAM,DEFRA,333797,64386.00,Contribution for DEFRA BGS Data Set Licence,YO1 7PX,SUPPLIER,C23910,NE162728,Expense,888800181.
DEFRA,NE,02/05/2024,EXP - PURCHASE OF GOODS/SERVICESĀ- RESEARCH & DEVELOPMENT - OTHER OUTSOURCED,NATURAL CAPITAL ECOSYSTEM ASSESSMENT - MARINE EVIDENCE,OXFORD BROOKES UNIVERSITY,INV0057922,27000.00, Memorandum of Understanding - delivery and citizen science generated analysis of digital imagery,OX3 0BP,SUPPLIER,,00000000,Expense,
DEFRA,NE,02/05/2024,EXP - PURCHASE OF GOODS/SERVICES - OTHER - PROGRAMME EXPENDITURE,ANALYTICS TEAM,DEFRA,331054,-76213.01,Credit - Alpha and Beta phases  CMSI replacement project - staff recharge costs,YO1 7PX,SUPPLIER,DFP (DEFRA),00000000,Expense,888800181.
DEFRA,NE,03/05/2024,EXP - PURCHASE OF GOODS/SERVICESĀ- RESEARCH & DEVELOPMENT - OTHER OUTSOURCED,"SGA STRATEGY, FUNDING & PEOPLE FOR NATURE",OFFICE FOR NATIONAL STATISTIC,2964133,69374.24,Memorandum of Agreement - Development of an experimental indicator to measure engagement with nature,NP10 8XG,SUPPLIER,Sub-50k,NE163925,Expense,GB888846049
DEFRA,NE,07/05/2024,EXP CAPITAL GRANTS TO PTE SECTOR - PERSONS & NON PROFIT INSTIT'NS SERVING H'HOLD,"SGA LANDSCAPE, PEAT & SPECIES",WILDFOWL & WETLANDS TRUST,ERS-100900056814-323294,266407.16,Grant - Species Recovery Programme - Godwit Futures - 2023-24,GL2 7BP,SUPPLIER,20484,NE163980,Expense,6183 68028
DEFRA,NE,07/05/2024,EXP - PURCHASE OF GOODS/SERVICESĀ- RESEARCH & DEVELOPMENT - OTHER OUTSOURCED,Natural Capital & Ecosystem Assessment - Terrestrial,RUGGED MOBILE SYSTEMS LTD,6872,288657.96,Natural Capital Ecosystem Assessment - Geode Receivers to EES Field Surveyors,LL14 5NS,SUPPLIER,C23823,00000000,Expense,913172842
DEFRA,NE,07/05/2024,EXP CAPITAL GRANTS TO PTE SECTOR - PERSONS & NON PROFIT INSTIT'NS SERVING H'HOLD,"SGA LANDSCAPE, PEAT & SPECIES",BUTTERFLY CONSERVATION,ERS-100900056835-323293,36979.23,Grant - Species Recovery Programme - Threatened Species Recovery for Northamptonshire's Woodlands - 2023-24,BH20 5QP,3RD SECTOR SUPPLIER,20434,NE163980,Expense,GB991277189
DEFRA,NE,07/05/2024,IA - POA & AUC - COST - ADDITIONS,Natural Capital & Ecosystem Assessment - Terrestrial,ICF CONSULTING SERVICES LTD,30412436,61435.81,Engagement and Evaluation of Citizen Science Pilots,EC2R 8HP,SUPPLIER,C19791,00000000,Asset,927 4872 86
DEFRA,NE,07/05/2024,EXP CAPITAL GRANTS TO PTE SECTOR - PERSONS & NON PROFIT INSTIT'NS SERVING H'HOLD,"SGA LANDSCAPE, PEAT & SPECIES",YORK ST JOHN UNIVERSITY,ERS-100900056824-323290,26217.88,Grant - Species Recovery Programme -  Foss River Restoration and Pond and Tansy Trail Creation - 2023-24,YO31 7EX,SUPPLIER,20490,NE163980,Expense,171893830
